{
  "$schema": "https://json-schema.org/draft/2020-12/schema",
  "$id": "https://rabbit-learning.example/schemas/question-bank-v2.json",
  "title": "Rabbit question bank v2",
  "type": "object",
  "additionalProperties": false,
  "required": ["schemaVersion", "generatorVersion", "publicationStatus", "subject", "title", "locale", "templates"],
  "properties": {
    "schemaVersion": { "const": 2 },
    "generatorVersion": { "type": "string", "pattern": "^[0-9]+\\.[0-9]+\\.[0-9]+$" },
    "publicationStatus": { "enum": ["draft", "published"] },
    "subject": { "$ref": "#/$defs/stableId" },
    "title": { "type": "string", "minLength": 1, "maxLength": 100 },
    "locale": { "type": "string", "pattern": "^[a-z]{2}-[A-Z]{2}$" },
    "templates": { "type": "array", "minItems": 1, "items": { "oneOf": [
      { "$ref": "#/$defs/computedTemplate" },
      { "$ref": "#/$defs/factCollectionTemplate" }
    ] } }
  },
  "$defs": {
    "stableId": { "type": "string", "pattern": "^[a-z][a-z0-9]*(?:[.-][a-z0-9]+)*$" },
    "expression": { "type": "string", "minLength": 1, "maxLength": 200 },
    "parameter": {
      "type": "object", "additionalProperties": false, "required": ["type", "min", "max"],
      "properties": {
        "type": { "const": "integer" }, "min": { "type": "integer" },
        "max": { "type": "integer" }, "step": { "type": "integer", "minimum": 1 }
      }
    },
    "block": {
      "type": "object", "additionalProperties": false, "required": ["type", "value"],
      "properties": { "type": { "enum": ["text", "math"] }, "value": { "type": "string", "minLength": 1, "maxLength": 500 } }
    },
    "accessibility": {
      "type": "object", "additionalProperties": false, "required": ["screenReaderText"],
      "properties": { "screenReaderText": { "type": "string", "minLength": 5, "maxLength": 500 } }
    },
    "computedDistractor": {
      "type": "object", "additionalProperties": false,
      "required": ["id", "misconception", "expression", "feedback"],
      "properties": {
        "id": { "$ref": "#/$defs/stableId" }, "misconception": { "$ref": "#/$defs/stableId" },
        "expression": { "$ref": "#/$defs/expression" }, "feedback": { "type": "string", "minLength": 10, "maxLength": 300 }
      }
    },
    "computedTemplate": {
      "type": "object", "additionalProperties": false,
      "required": ["id", "version", "type", "skill", "difficulty", "parameters", "prompt", "answer", "distractors", "hint", "explanation", "accessibility"],
      "properties": {
        "id": { "$ref": "#/$defs/stableId" }, "version": { "type": "integer", "minimum": 1 },
        "type": { "const": "single-select" }, "skill": { "$ref": "#/$defs/stableId" },
        "difficulty": { "type": "integer", "minimum": 1, "maximum": 5 },
        "parameters": {
          "type": "object", "minProperties": 1, "propertyNames": { "pattern": "^[a-z][a-z0-9_]*$" },
          "additionalProperties": { "$ref": "#/$defs/parameter" }
        },
        "prompt": { "type": "array", "minItems": 1, "items": { "$ref": "#/$defs/block" } },
        "answer": {
          "type": "object", "additionalProperties": false, "required": ["expression", "format"],
          "properties": { "expression": { "$ref": "#/$defs/expression" }, "format": { "enum": ["number", "decimal", "money"] } }
        },
        "distractors": { "type": "array", "minItems": 3, "items": { "$ref": "#/$defs/computedDistractor" } },
        "hint": { "type": "string", "minLength": 5, "maxLength": 250 },
        "explanation": { "type": "string", "minLength": 10, "maxLength": 500 },
        "visual": {
          "type": "object", "additionalProperties": false, "required": ["type", "numerator", "denominator", "alt"],
          "properties": {
            "type": { "const": "fraction-bar" }, "numerator": { "$ref": "#/$defs/expression" },
            "denominator": { "$ref": "#/$defs/expression" }, "alt": { "type": "string", "minLength": 5, "maxLength": 200 }
          }
        },
        "accessibility": { "$ref": "#/$defs/accessibility" }
      }
    },
    "fact": {
      "type": "object", "additionalProperties": { "type": ["string", "integer"] },
      "required": ["id"], "properties": { "id": { "$ref": "#/$defs/stableId" } }, "minProperties": 3
    },
    "factVariant": {
      "type": "object", "additionalProperties": false,
      "required": ["id", "difficulty", "prompt", "answerField", "distractorPoolField", "misconception", "feedback", "hint", "explanation", "accessibility"],
      "properties": {
        "id": { "$ref": "#/$defs/stableId" }, "difficulty": { "type": "integer", "minimum": 1, "maximum": 5 },
        "prompt": { "type": "array", "minItems": 1, "items": { "$ref": "#/$defs/block" } },
        "answerField": { "type": "string", "pattern": "^[a-z][a-zA-Z0-9]*$" },
        "distractorPoolField": { "type": "string", "pattern": "^[a-z][a-zA-Z0-9]*$" },
        "misconception": { "$ref": "#/$defs/stableId" },
        "feedback": { "type": "string", "minLength": 10, "maxLength": 300 },
        "hint": { "type": "string", "minLength": 5, "maxLength": 250 },
        "explanation": { "type": "string", "minLength": 10, "maxLength": 500 },
        "accessibility": { "$ref": "#/$defs/accessibility" }
      }
    },
    "source": {
      "type": "object", "additionalProperties": false, "required": ["title", "url", "locator", "reviewStatus"],
      "properties": {
        "title": { "type": "string", "minLength": 1 }, "url": { "type": "string", "format": "uri" },
        "locator": { "type": "string", "minLength": 1 }, "reviewStatus": { "enum": ["draft", "reviewed"] }
      }
    },
    "factCollectionTemplate": {
      "type": "object", "additionalProperties": false,
      "required": ["id", "version", "type", "skill", "knowledge", "variants", "source"],
      "properties": {
        "id": { "$ref": "#/$defs/stableId" }, "version": { "type": "integer", "minimum": 1 },
        "type": { "const": "fact-collection-single-select" }, "skill": { "$ref": "#/$defs/stableId" },
        "knowledge": {
          "type": "object", "additionalProperties": false, "required": ["type", "facts"],
          "properties": { "type": { "const": "historical-events" }, "facts": { "type": "array", "minItems": 4, "items": { "$ref": "#/$defs/fact" } } }
        },
        "variants": { "type": "array", "minItems": 1, "items": { "$ref": "#/$defs/factVariant" } },
        "source": { "$ref": "#/$defs/source" }
      }
    }
  }
}
